{
  "id": 338,
  "name": "Treatment after diving",
  "requirements": {
    "guaranteed": []
  },
  "verification": {
    "status": "verified",
    "checked_at": "2026-07-24",
    "sources": [
      "https://www.missionchief.co.uk/einsaetze/338",
      "https://www.missionchief.co.uk/einsaetze.json"
    ]
  },
  "preconditions": {
    "rescue_stations": 1
  },
  "patients": {
    "maximum": 1,
    "minimum": 1,
    "specializations": [
      "General Surgeon"
    ],
    "specialization_ids": [
      1
    ],
    "specialization_text": "General Surgeon",
    "codes": [
      "C-3"
    ],
    "transport_probability": 0.0
  },
  "availability_window": {
    "starts_at": "2026-06-11T09:00:00Z",
    "ends_at": "2026-07-19T22:00:00Z"
  },
  "official_metadata": {
    "generator_family": "ambulance_station_missions",
    "mission_categories": [
      "ambulance"
    ],
    "icons": [
      "/images/soccer_gruen.png",
      "/images/soccer_gelb.png",
      "/images/soccer_rot.png"
    ],
    "base_mission_id": 338,
    "additive_overlays": "",
    "overlay_index": null,
    "generated_by": "",
    "additional": {
      "date_end": "2026-07-19T22:00:00Z",
      "date_start": "2026-06-11T09:00:00Z"
    }
  },
  "service": "ambulance",
  "generation_rules": {
    "main_building_type": 2
  },
  "mission_types": [
    "Ambulance Missions"
  ],
  "notes": [
    "Generated deterministically from the retained official UK mission snapshot.",
    "Resource, personnel, operational, prerequisite, patient and relationship fields are protected by strict official equivalence validators."
  ]
}
