{
  "id": 166,
  "name": "Easter egg hunt",
  "requirements": {
    "guaranteed": [
      {
        "resource": "police_car",
        "quantity": 6
      }
    ]
  },
  "verification": {
    "status": "verified",
    "checked_at": "2026-07-24",
    "sources": [
      "https://www.missionchief.co.uk/einsaetze/166",
      "https://www.missionchief.co.uk/einsaetze.json"
    ]
  },
  "preconditions": {
    "police_stations": 3
  },
  "reward": {
    "average_credits": 1000
  },
  "availability_window": {
    "starts_at": "2026-03-20T10:00:00Z",
    "ends_at": "2026-04-07T23:59:59+01:00"
  },
  "official_metadata": {
    "generator_family": "police_station_missions",
    "mission_categories": [
      "police"
    ],
    "icons": [
      "/images/theft_gruen.png",
      "/images/theft_gelb.png",
      "/images/theft_rot.png"
    ],
    "base_mission_id": 166,
    "additive_overlays": "",
    "overlay_index": null,
    "generated_by": "",
    "additional": {
      "date_end": "2026-04-07T23:59:59+01:00",
      "date_start": "2026-03-20T10:00:00Z"
    }
  },
  "service": "police",
  "generation_rules": {
    "main_building_type": 6
  },
  "mission_types": [
    "Police Missions"
  ],
  "notes": [
    "Generated deterministically from the retained official UK mission snapshot.",
    "Resource, personnel, operational, prerequisite, patient and relationship fields are protected by strict official equivalence validators."
  ]
}
