{
  "id": 46,
  "name": "Parked car accident",
  "requirements": {
    "guaranteed": [
      {
        "resource": "police_car",
        "quantity": 1
      }
    ]
  },
  "verification": {
    "status": "verified",
    "checked_at": "2026-07-24",
    "sources": [
      "https://www.missionchief.co.uk/einsaetze/46",
      "https://www.missionchief.co.uk/einsaetze.json"
    ]
  },
  "poi": [
    "Supermarket (small)"
  ],
  "preconditions": {
    "police_stations": 1
  },
  "reward": {
    "average_credits": 120
  },
  "official_metadata": {
    "generator_family": "police_station_missions",
    "mission_categories": [
      "police"
    ],
    "icons": [
      "/images/caraccident_gruen.png",
      "/images/caraccident_gelb.png",
      "/images/caraccident_rot.png"
    ],
    "base_mission_id": 46,
    "additive_overlays": "",
    "overlay_index": null,
    "generated_by": "",
    "additional": {}
  },
  "service": "police",
  "generation_rules": {
    "main_building_type": 6
  },
  "mission_types": [
    "Police Missions"
  ],
  "notes": [
    "Generated deterministically from the retained official UK mission snapshot.",
    "Resource, personnel, operational, prerequisite, patient and relationship fields are protected by strict official equivalence validators."
  ]
}
