{
  "id": 858,
  "name": "Dryer on fire",
  "requirements": {
    "guaranteed": [
      {
        "resource": "fire_engine",
        "quantity": 1
      }
    ]
  },
  "verification": {
    "status": "verified",
    "checked_at": "2026-07-24",
    "sources": [
      "https://www.missionchief.co.uk/einsaetze/858",
      "https://www.missionchief.co.uk/einsaetze.json"
    ]
  },
  "poi": [
    "Launderette"
  ],
  "preconditions": {
    "fire_stations": 3
  },
  "reward": {
    "average_credits": 1010
  },
  "official_metadata": {
    "generator_family": "firehouse_missions",
    "mission_categories": [
      "fire"
    ],
    "icons": [
      "/images/fire_gruen.png",
      "/images/fire_gelb.png",
      "/images/fire_rot.png"
    ],
    "base_mission_id": 858,
    "additive_overlays": "",
    "overlay_index": null,
    "generated_by": "",
    "additional": {}
  },
  "service": "fire",
  "generation_rules": {
    "main_building_type": 0
  },
  "mission_types": [
    "Fire Fighting Missions"
  ],
  "notes": [
    "Generated deterministically from the retained official UK mission snapshot.",
    "Resource, personnel, operational, prerequisite, patient and relationship fields are protected by strict official equivalence validators."
  ]
}
