{
  "id": 605,
  "name": "Risk fan escort",
  "requirements": {
    "guaranteed": [
      {
        "resource": "police_car",
        "quantity": 5
      }
    ]
  },
  "verification": {
    "status": "verified",
    "checked_at": "2026-07-24",
    "sources": [
      "https://www.missionchief.co.uk/einsaetze/605",
      "https://www.missionchief.co.uk/einsaetze.json"
    ]
  },
  "poi": [
    "Stadium",
    "Train station (regional traffic)",
    "Train station (regional traffic and long-distance travel)",
    "Bar",
    "Stadium\nTrain station (regional traffic)\nTrain station (regional traffic and long-distance travel)\nBar"
  ],
  "preconditions": {
    "police_stations": 6
  },
  "personnel": {
    "required": [
      {
        "role": "Level 2 Public Order Officer",
        "quantity": 24
      },
      {
        "role": "Police Inspector",
        "quantity": 1
      },
      {
        "role": "Police Sergeant",
        "quantity": 3
      }
    ],
    "available": [
      {
        "role": "Level 2 Public Order Officer",
        "quantity": 30
      },
      {
        "role": "Police Inspector",
        "quantity": 2
      },
      {
        "role": "Police Sergeant",
        "quantity": 5
      }
    ]
  },
  "prisoners": {
    "maximum": 4
  },
  "reward": {
    "average_credits": 8000
  },
  "official_metadata": {
    "generator_family": "police_station_missions",
    "mission_categories": [
      "police"
    ],
    "icons": [
      "/images/dancinghall_gruen.png",
      "/images/dancinghall_gelb.png",
      "/images/dancinghall_rot.png"
    ],
    "base_mission_id": 605,
    "additive_overlays": "",
    "overlay_index": null,
    "generated_by": "",
    "additional": {}
  },
  "service": "police",
  "generation_rules": {
    "main_building_type": 6
  },
  "mission_types": [
    "Police Missions"
  ],
  "notes": [
    "Generated deterministically from the retained official UK mission snapshot.",
    "Resource, personnel, operational, prerequisite, patient and relationship fields are protected by strict official equivalence validators."
  ]
}
