{
  "id": 162,
  "name": "Chocolate Tanker Spill",
  "requirements": {
    "guaranteed": [
      {
        "resource": "fire_engine",
        "quantity": 1
      },
      {
        "resource": "fire_officer",
        "quantity": 2
      },
      {
        "resource": "police_car",
        "quantity": 3
      },
      {
        "resource": "rescue_support_vehicle",
        "quantity": 2
      }
    ],
    "alternatives": [
      {
        "resources": [
          "hazmat_unit",
          "cbrn_vehicle"
        ],
        "quantity": 1,
        "notes": [
          "Any listed qualifying resource may satisfy this official alternative group."
        ]
      },
      {
        "resources": [
          "fire_engine",
          "rescue_support_vehicle"
        ],
        "quantity": 4,
        "notes": [
          "Any listed qualifying resource may satisfy this official alternative group."
        ]
      }
    ]
  },
  "verification": {
    "status": "verified",
    "checked_at": "2026-07-24",
    "sources": [
      "https://www.missionchief.co.uk/einsaetze/162",
      "https://www.missionchief.co.uk/einsaetze.json"
    ]
  },
  "preconditions": {
    "fire_stations": 10,
    "police_stations": 2
  },
  "reward": {
    "average_credits": 5000
  },
  "availability_window": {
    "starts_at": "2026-03-20T10:00:00Z",
    "ends_at": "2026-04-07T23:59:59+01:00"
  },
  "official_metadata": {
    "generator_family": "firehouse_missions",
    "mission_categories": [
      "fire",
      "rural",
      "urban"
    ],
    "icons": [
      "/images/oil_gruen.png",
      "/images/oil_gelb.png",
      "/images/oil_rot.png"
    ],
    "base_mission_id": 162,
    "additive_overlays": "",
    "overlay_index": null,
    "generated_by": "",
    "additional": {
      "date_end": "2026-04-07T23:59:59+01:00",
      "date_start": "2026-03-20T10:00:00Z"
    }
  },
  "service": "fire",
  "generation_rules": {
    "main_building_type": 0
  },
  "mission_types": [
    "Fire Fighting Missions"
  ],
  "notes": [
    "Generated deterministically from the retained official UK mission snapshot.",
    "Resource, personnel, operational, prerequisite, patient and relationship fields are protected by strict official equivalence validators."
  ]
}
