{
  "id": 741,
  "name": "Frozen Pipe Burst",
  "requirements": {
    "guaranteed": [
      {
        "resource": "fire_engine",
        "quantity": 1
      }
    ]
  },
  "verification": {
    "status": "verified",
    "checked_at": "2026-07-24",
    "sources": [
      "https://www.missionchief.co.uk/einsaetze/741",
      "https://www.missionchief.co.uk/einsaetze.json"
    ]
  },
  "preconditions": {
    "fire_stations": 1,
    "water_damage_pump_extensions": 1
  },
  "reward": {
    "average_credits": 3000
  },
  "water_requirements": {
    "minimum_pump_speed": 1000,
    "pump_water_amount": 10000
  },
  "availability_window": {
    "starts_at": "2026-01-02T10:00:00Z",
    "ends_at": "2026-03-06T22:59:00Z"
  },
  "official_metadata": {
    "generator_family": "firehouse_missions",
    "mission_categories": [
      "fire",
      "water_damage_and_flood"
    ],
    "icons": [
      "/images/river_gruen.png",
      "/images/river_gelb.png",
      "/images/river_rot.png"
    ],
    "base_mission_id": 741,
    "additive_overlays": "",
    "overlay_index": null,
    "generated_by": "",
    "additional": {
      "date_end": "2026-03-06T22:59:00Z",
      "date_start": "2026-01-02T10:00:00Z",
      "pump_water_amount": 10000
    }
  },
  "service": "fire",
  "generation_rules": {
    "main_building_type": 0
  },
  "mission_types": [
    "Fire Fighting Missions"
  ],
  "notes": [
    "Generated deterministically from the retained official UK mission snapshot.",
    "Resource, personnel, operational, prerequisite, patient and relationship fields are protected by strict official equivalence validators."
  ]
}
